{
  "schemaVersion": 1,
  "id": "recommended",
  "enabledByDefault": true,
  "rules": [
    {
      "id": "negative-zero",
      "query": "queries/lint/negative-zero.scm",
      "enabledByDefault": true,
      "severity": "warning",
      "message": "Use 0 instead of -0.",
      "diagnosticCapture": "diagnostic",
      "fix": {
        "title": "Replace -0 with 0",
        "operation": "replace",
        "targetCapture": "diagnostic",
        "template": "0"
      }
    },
    {
      "id": "empty-object-key",
      "query": "queries/lint/empty-object-key.scm",
      "enabledByDefault": true,
      "severity": "warning",
      "message": "Avoid empty object keys.",
      "diagnosticCapture": "diagnostic"
    }
  ]
}
